{
  "kind": "worm_evidence_bundle",
  "schemaVersion": 1,
  "bundleId": "bundle-001",
  "runId": "worm-run-20260422-0005",
  "lane": "worm",
  "sourceRepo": "Boswecw/Cortex",
  "sourceArtifacts": [
    {
      "path": ".gitmodules",
      "artifactSha256": "abc123",
      "adapterName": "gitmodules_parse"
    }
  ],
  "edges": [
    {
      "kind": "worm_edge",
      "schemaVersion": 1,
      "edgeId": "edge-101",
      "relationType": "git_submodule",
      "sourceRepo": "Boswecw/Cortex",
      "sourceArtifact": {
        "path": ".gitmodules",
        "line": 3,
        "artifactSha256": "abc123"
      },
      "discoveryMethod": "gitmodules_parse",
      "target": {
        "rawReference": "../linked-repo",
        "normalizedRepo": "Boswecw/linked-repo",
        "identityPosture": "resolved"
      },
      "crawlScope": "cross_repo",
      "confidence": "high",
      "posture": "evidence_bound",
      "timestamp": "2026-04-22T00:05:00-04:00"
    }
  ],
  "findings": [
    {
      "kind": "worm_finding",
      "schemaVersion": 1,
      "findingId": "finding-201",
      "findingClass": "stale_submodule_pointer",
      "sourceRepo": "Boswecw/Cortex",
      "sourceArtifact": {
        "path": ".gitmodules",
        "line": 3,
        "artifactSha256": "abc123"
      },
      "relatedEdgeIds": [
        "edge-101"
      ],
      "target": {
        "rawReference": "../linked-repo",
        "normalizedRepo": "Boswecw/linked-repo",
        "identityPosture": "resolved"
      },
      "reasonCode": "submodule_pointer_no_longer_matches_expected_target_state",
      "crawlScope": "cross_repo",
      "confidence": "medium",
      "posture": "evidence_bound",
      "timestamp": "2026-04-22T00:05:00-04:00"
    }
  ],
  "targetResolutions": [
    {
      "kind": "worm_target_resolution",
      "schemaVersion": 1,
      "resolutionId": "resolve-101",
      "rawReference": "../linked-repo",
      "resolutionPosture": "resolved",
      "resolutionMethod": "manual_mapping",
      "canonicalIdentity": {
        "host": "github.com",
        "owner": "Boswecw",
        "repo": "linked-repo",
        "display": "Boswecw/linked-repo"
      },
      "evidence": [
        "mapping from governed repo registry"
      ],
      "timestamp": "2026-04-22T00:05:00-04:00"
    }
  ],
  "timestamp": "2026-04-22T00:05:00-04:00"
}